BEGIN;
BEGIN
SET client_min_messages TO NOTICE;
SET
SET search_path TO 'example2', 'public';
SET
UPDATE vehicles
    SET stops = NULL;
UPDATE 180
SELECT * FROM shipments
WHERE id IN (73, 93, 203, 219, 302, 425, 505, 507, 508)
ORDER BY id;
 id  | amount |     p_id      |      p_tw_open      |     p_tw_close      | p_t_service |     d_id      |         d_tw_open          |         d_tw_close         | d_t_service |   p_open   |  p_close   | p_service |   d_open   |  d_close   | d_service | multiplier |        booking_date
-----+--------+---------------+---------------------+---------------------+-------------+---------------+----------------------------+----------------------------+-------------+------------+------------+-----------+------------+------------+-----------+------------+----------------------------
  73 |      1 | 3613481403169 | 2019-12-09 10:00:00 | 2019-12-09 10:20:00 | 00:00:00    | 3618791402920 | 2019-12-09 10:12:36.442156 | 2019-12-09 10:42:56.724725 | 00:00:00    | 1575885600 | 1575886800 |         0 | 1575886356 | 1575888177 |         0 |        1.3 | 2019-12-03 07:09:09.730552
  93 |      1 | 3618151403079 | 2019-12-09 15:00:00 | 2019-12-09 15:20:00 | 00:00:00    | 3623001402477 | 2019-12-09 15:15:16.02545  | 2019-12-09 15:47:47.166319 | 00:00:00    | 1575903600 | 1575904800 |         0 | 1575904516 | 1575906467 |         0 |        1.2 | 2019-12-03 07:44:36.398735
 203 |      1 | 3620691402610 | 2019-12-11 10:00:00 | 2019-12-11 10:20:00 | 00:00:00    | 3622251402693 | 2019-12-11 10:03:46.206842 | 2019-12-11 10:26:51.696453 | 00:00:00    | 1576058400 | 1576059600 |         0 | 1576058626 | 1576060012 |         0 |        1.3 | 2019-12-04 01:04:13.737657
 219 |      1 | 3619081402798 | 2019-12-09 15:00:00 | 2019-12-09 15:20:00 | 00:00:00    | 3619611402670 | 2019-12-09 15:02:35.133883 | 2019-12-09 15:24:42.343667 | 00:00:00    | 1575903600 | 1575904800 |         0 | 1575903755 | 1575905082 |         0 |        1.2 | 2019-12-04 04:44:36.203209
 302 |      1 | 3614971402781 | 2019-12-09 10:00:00 | 2019-12-09 10:20:00 | 00:00:00    | 3616211403024 | 2019-12-09 10:05:10.024033 | 2019-12-09 10:29:24.243741 | 00:00:00    | 1575885600 | 1575886800 |         0 | 1575885910 | 1575887364 |         0 |        1.3 | 2019-12-05 01:18:36.008486
 425 |      1 | 3618641402722 | 2019-12-09 14:00:00 | 2019-12-09 14:20:00 | 00:00:00    | 3618151402832 | 2019-12-09 14:02:15.484283 | 2019-12-09 14:24:06.581396 | 00:00:00    | 1575900000 | 1575901200 |         0 | 1575900135 | 1575901447 |         0 |        1.2 | 2019-12-06 00:56:20.951084
 505 |      1 | 3618671402855 | 2019-12-09 14:00:00 | 2019-12-09 14:20:00 | 00:00:00    | 3619091402880 | 2019-12-09 14:01:02.094923 | 2019-12-09 14:21:53.012761 | 00:00:00    | 1575900000 | 1575901200 |         0 | 1575900062 | 1575901313 |         0 |        1.2 | 2019-12-06 05:51:15.543987
 507 |      1 | 3618671402855 | 2019-12-09 14:00:00 | 2019-12-09 14:20:00 | 00:00:00    | 3619091402880 | 2019-12-09 14:01:02.094923 | 2019-12-09 14:21:53.012761 | 00:00:00    | 1575900000 | 1575901200 |         0 | 1575900062 | 1575901313 |         0 |        1.2 | 2019-12-06 05:54:24.886416
 508 |      1 | 3618791402920 | 2019-12-09 14:00:00 | 2019-12-09 14:20:00 | 00:00:00    | 3619401402840 | 2019-12-09 14:01:58.547074 | 2019-12-09 14:23:35.755675 | 00:00:00    | 1575900000 | 1575901200 |         0 | 1575900119 | 1575901416 |         0 |        1.2 | 2019-12-06 06:03:13.693134
(9 rows)

UPDATE shipments
SET p_t_service = '00:01:00',
    d_t_service = '00:02:00';
UPDATE 676
/*******
Creating a fix initial solution
*******/
UPDATE vehicles AS v
SET stops = ARRAY[302, 73, 302, 73]
WHERE v.id = 580;
UPDATE 1
UPDATE vehicles AS v
SET stops = ARRAY[425,425,505,507,508,505,507,508,93,219,219,203,203,93]
WHERE v.id = 585;
UPDATE 1
SELECT id, stops
FROM vehicles
WHERE id IN (580, 699, 585)
ORDER BY id;
 id  |                          stops
-----+---------------------------------------------------------
 580 | {302,73,302,73}
 585 | {425,425,505,507,508,505,507,508,93,219,219,203,203,93}
 699 |
(3 rows)

SELECT *, id_to_geom(stop_id) AS location
FROM vrp_viewRoute(
    $$SELECT * FROM shipments$$::TEXT,
    $$SELECT * FROM vehicles$$::TEXT,
    $$SELECT start_vid, end_vid, travel_time FROM timeMatrix$$::TEXT,
    $$SELECT * FROM tdm('2019-12-09'::TIMESTAMP, '2019-12-13'::TIMESTAMP)$$::TEXT,
    580::BIGINT, factor => 1.0::float);
 seq | vehicle_seq | vehicle_id | stop_seq | stop_type |    stop_id    | shipment_id | load |  travel  |       arrival       | waiting_time |      schedule       | service  |      departure      | cvtot | twvtot |                      location
-----+-------------+------------+----------+-----------+---------------+-------------+------+----------+---------------------+--------------+---------------------+----------+---------------------+-------+--------+----------------------------------------------------
   1 |           1 |        580 |        1 |         1 | 3619121402769 |          -1 |    0 | 00:00:00 | 2019-12-09 09:50:00 | 00:00:00     | 2019-12-09 09:50:00 | 00:00:00 | 2019-12-09 09:50:00 |     0 |      0 | 0101000020E61000006688635DDC886140637FD93D79184240
   2 |           1 |        580 |        2 |         2 | 3614971402781 |         302 |    1 | 00:12:00 | 2019-12-09 10:02:00 | 00:00:00     | 2019-12-09 10:02:00 | 00:01:00 | 2019-12-09 10:03:00 |     0 |      0 | 0101000020E610000090A0F831E6886140091B9E5E29134240
   3 |           1 |        580 |        3 |         2 | 3613481403169 |          73 |    2 | 00:11:55 | 2019-12-09 10:14:55 | 00:00:00     | 2019-12-09 10:14:55 | 00:01:00 | 2019-12-09 10:15:55 |     0 |      0 | 0101000020E61000004703780B248A61401AC05B2041114240
   4 |           1 |        580 |        4 |         3 | 3616211403024 |         302 |    1 | 00:08:51 | 2019-12-09 10:24:46 | 00:00:00     | 2019-12-09 10:24:46 | 00:02:00 | 2019-12-09 10:26:46 |     0 |      0 | 0101000020E6100000EFC9C342AD8961403F575BB1BF144240
   5 |           1 |        580 |        5 |         3 | 3618791402920 |          73 |    0 | 00:10:16 | 2019-12-09 10:37:02 | 00:00:00     | 2019-12-09 10:37:02 | 00:02:00 | 2019-12-09 10:39:02 |     0 |      0 | 0101000020E6100000D34D6210588961408E75711B0D184240
   6 |           1 |        580 |        6 |         4 | 3619121402769 |          -1 |    0 | 00:05:05 | 2019-12-09 10:44:07 | 00:00:00     | 2019-12-09 10:44:07 | 00:00:00 | 2019-12-09 10:44:07 |     0 |      0 | 0101000020E61000006688635DDC886140637FD93D79184240
(6 rows)

SELECT *, id_to_geom(stop_id) AS location
FROM vrp_viewRoute(
    $$SELECT * FROM shipments$$,
    $$SELECT * FROM vehicles$$,
    $$SELECT start_vid, end_vid, travel_time FROM timeMatrix$$,
    $$SELECT * FROM tdm('2019-12-09'::TIMESTAMP, '2019-12-13'::TIMESTAMP)$$,
    699::BIGINT, factor => 1.0::float);
NOTICE:  Insufficient data found on 'orders' inner query
HINT:
          WITH
            __shipments AS (SELECT * FROM shipments),
            __vehicles AS (SELECT * FROM vehicles)
          SELECT * FROM __shipments
          WHERE id IN (SELECT distinct(unnest(stops)) FROM  __vehicles v WHERE id = 699)

 seq | vehicle_seq | vehicle_id | stop_seq | stop_type | stop_id | shipment_id | load | travel | arrival | waiting_time | schedule | service | departure | cvtot | twvtot | location
-----+-------------+------------+----------+-----------+---------+-------------+------+--------+---------+--------------+----------+---------+-----------+-------+--------+----------
(0 rows)

SELECT *, id_to_geom(stop_id) AS location
FROM vrp_viewRoute(
    $$SELECT * FROM shipments$$,
    $$SELECT * FROM vehicles$$,
    $$SELECT start_vid, end_vid, travel_time FROM timeMatrix$$,
    $$SELECT * FROM tdm('2019-12-09'::TIMESTAMP, '2019-12-13'::TIMESTAMP)$$,
    585::BIGINT, factor => 1.0::float);
 seq | vehicle_seq | vehicle_id | stop_seq | stop_type |    stop_id    | shipment_id | load |  travel  |       arrival       | waiting_time |      schedule       | service  |      departure      | cvtot | twvtot |                      location
-----+-------------+------------+----------+-----------+---------------+-------------+------+----------+---------------------+--------------+---------------------+----------+---------------------+-------+--------+----------------------------------------------------
   1 |           1 |        585 |        1 |         1 | 3619121402769 |          -1 |    0 | 00:00:00 | 2019-12-09 14:00:00 | 00:00:00     | 2019-12-09 14:00:00 | 00:00:00 | 2019-12-09 14:00:00 |     0 |      0 | 0101000020E61000006688635DDC886140637FD93D79184240
   2 |           1 |        585 |        2 |         2 | 3618641402722 |         425 |    1 | 00:01:50 | 2019-12-09 14:01:50 | 00:00:00     | 2019-12-09 14:01:50 | 00:01:00 | 2019-12-09 14:02:50 |     0 |      0 | 0101000020E6100000143FC6DCB5886140B9FC87F4DB174240
   3 |           1 |        585 |        3 |         3 | 3618151402832 |         425 |    0 | 00:03:03 | 2019-12-09 14:05:53 | 00:00:00     | 2019-12-09 14:05:53 | 00:02:00 | 2019-12-09 14:07:53 |     0 |      0 | 0101000020E6100000454772F90F896140AC1C5A643B174240
   4 |           1 |        585 |        4 |         2 | 3618671402855 |         505 |    1 | 00:03:33 | 2019-12-09 14:11:26 | 00:00:00     | 2019-12-09 14:11:26 | 00:01:00 | 2019-12-09 14:12:26 |     0 |      0 | 0101000020E61000004260E5D022896140E4141DC9E5174240
   5 |           1 |        585 |        5 |         2 | 3618671402855 |         507 |    2 | 00:00:00 | 2019-12-09 14:12:26 | 00:00:00     | 2019-12-09 14:12:26 | 00:01:00 | 2019-12-09 14:13:26 |     0 |      0 | 0101000020E61000004260E5D022896140E4141DC9E5174240
   6 |           1 |        585 |        6 |         2 | 3618791402920 |         508 |    3 | 00:02:31 | 2019-12-09 14:15:57 | 00:00:00     | 2019-12-09 14:15:57 | 00:01:00 | 2019-12-09 14:16:57 |     0 |      0 | 0101000020E6100000D34D6210588961408E75711B0D184240
   7 |           1 |        585 |        7 |         3 | 3619091402880 |         505 |    2 | 00:03:06 | 2019-12-09 14:20:03 | 00:00:00     | 2019-12-09 14:20:03 | 00:02:00 | 2019-12-09 14:22:03 |     0 |      0 | 0101000020E6100000F0A7C64B37896140386744696F184240
   8 |           1 |        585 |        8 |         3 | 3619091402880 |         507 |    1 | 00:00:00 | 2019-12-09 14:22:03 | 00:00:00     | 2019-12-09 14:22:03 | 00:02:00 | 2019-12-09 14:24:03 |     0 |      1 | 0101000020E6100000F0A7C64B37896140386744696F184240
   9 |           1 |        585 |        9 |         3 | 3619401402840 |         508 |    0 | 00:03:18 | 2019-12-09 14:27:21 | 00:00:00     | 2019-12-09 14:27:21 | 00:02:00 | 2019-12-09 14:29:21 |     0 |      2 | 0101000020E61000000C022B871689614046B6F3FDD4184240
  10 |           1 |        585 |       10 |         2 | 3618151403079 |          93 |    1 | 00:06:03 | 2019-12-09 14:35:24 | 00:24:36     | 2019-12-09 15:00:00 | 00:01:00 | 2019-12-09 15:01:00 |     0 |      2 | 0101000020E610000007CE1951DA896140AC1C5A643B174240
  11 |           1 |        585 |       11 |         2 | 3619081402798 |         219 |    2 | 00:05:06 | 2019-12-09 15:06:06 | 00:00:00     | 2019-12-09 15:06:06 | 00:01:00 | 2019-12-09 15:07:06 |     0 |      2 | 0101000020E6100000772D211FF4886140D50968226C184240
  12 |           1 |        585 |       12 |         3 | 3619611402670 |         219 |    1 | 00:05:37 | 2019-12-09 15:12:43 | 00:00:00     | 2019-12-09 15:12:43 | 00:02:00 | 2019-12-09 15:14:43 |     0 |      2 | 0101000020E6100000068195438B886140705F07CE19194240
  13 |           1 |        585 |       13 |         2 | 3620691402610 |         203 |    2 | 00:04:44 | 2019-12-09 15:19:27 | 42:40:33     | 2019-12-11 10:00:00 | 00:01:00 | 2019-12-11 10:01:00 |     0 |      2 | 0101000020E61000003108AC1C5A8861406DC5FEB27B1A4240
  14 |           1 |        585 |       14 |         3 | 3622251402693 |         203 |    1 | 00:05:21 | 2019-12-11 10:06:21 | 00:00:00     | 2019-12-11 10:06:21 | 00:02:00 | 2019-12-11 10:08:21 |     0 |      2 | 0101000020E6100000029A081B9E88614014AE47E17A1C4240
  15 |           1 |        585 |       15 |         3 | 3623001402477 |          93 |    0 | 00:08:27 | 2019-12-11 10:16:48 | 00:00:00     | 2019-12-11 10:16:48 | 00:02:00 | 2019-12-11 10:18:48 |     0 |      3 | 0101000020E610000004E78C28ED8761403D0AD7A3701D4240
  16 |           1 |        585 |       16 |         4 | 3619121402769 |          -1 |    0 | 00:12:31 | 2019-12-11 10:31:19 | 00:00:00     | 2019-12-11 10:31:19 | 00:00:00 | 2019-12-11 10:31:19 |     0 |      4 | 0101000020E61000006688635DDC886140637FD93D79184240
(16 rows)

ROLLBACK;
ROLLBACK
